{"$schema":"https://json-schema.org/draft/2020-12/schema","title":"Agent Fabric v1 task request","type":"object","additionalProperties":false,"required":["version","request_id","workspace","relative_path","prompt","runtime","initiator","timeout_seconds"],"properties":{"version":{"const":1},"request_id":{"type":"string","format":"uuid"},"workspace":{"type":"string","pattern":"^[A-Za-z0-9][A-Za-z0-9._-]{0,127}$"},"relative_path":{"type":"string","pattern":"^(?:\\.|(?!/)(?!\\./)(?!.*//)(?!.*(?:^|/)\\.\\.?/)(?!.*(?:^|/)\\.\\.?$).+)$"},"prompt":{"type":"string","minLength":1,"maxLength":16384},"runtime":{"enum":["pi","opencode","claude"]},"initiator":{"enum":["macbook","mac-mini"]},"timeout_seconds":{"type":"integer","minimum":1}}}
